{
    "pages": [
        {
            "page_number": 1,
            "data": {
                "Title": "R&D Data Packet Cover Sheet",
                "Document ID": "FRM-SOP-AD-ADC-000001",
                "Version": "2",
                "R&D Data Packet Number": "RDDD - 12505",
                "Analytical Test Method Title": "ddPCR Vector Genome Titer Method",
                "Academic Test Method Number and Version": "ADMD - 000013, Version 3",
                "Analytical Test Method Performed By": "Claudia Lou",
                "Date Analytical Test Method Started": "03/06/2024",
                "Date Analytical Test Method Completed": "03/06/2024",
                "Sample Type": [
                    "IP/PB",
                    "Stability",
                    "R&D",
                    "CTL",
                    "non-GxP Other"
                ],
                "Result Table": {
                    "Sample ID": [
                        "PS-002",
                        "Thawed DS",
                        "Diluted DS",
                        "",
                        "",
                        "",
                        "",
                        ""
                    ],
                    "Lot Number": [
                        "PDTP-000046",
                        "PDTP-000046",
                        "PDTP-000046",
                        "",
                        "",
                        "",
                        "",
                        ""
                    ],
                    "Specification (if applicable)": [
                        "1.0E+13 vg/mL \u00b1 20%",
                        "Report Result",
                        "Report Result",
                        "",
                        "",
                        "",
                        "",
                        ""
                    ],
                    "Result": [
                        "1.13E+13 c/mL at 246 mL = 2.78E+15 copies",
                        "1.71E+13 c/mL at 185 mL = 3.15E+15 copies",
                        "1.16E+13 c/mL at 265 mL = 3.07E+15 copies",
                        "",
                        "",
                        "",
                        "",
                        ""
                    ]
                },
                "Completed by": "Claudia Lou",
                "Date": "03/06/2024",
                "Peer Review Approval": {
                    "Name": "Commit",
                    "Date": "03/10/2024"
                },
                "Document Reference": {
                    "FRM-SOP-AD-ADC-000001": "",
                    "Parent Document ID": "SOP-AD-ADC-000009"
                },
                "Printed on": "3/6/2024 3:47 PM"
            },
            "raw_text": "RDDD - 12505 Academic Test Method Title: dPCR Vector Genome Titer Method oo mAickling targeting Academic Test Method Number and Version: ADMD - 000013, Version 3 Analytical Test Method Performed By: Claudia Lou Date Analytical Test Method Started: 03/06/2024 Date Analytical Test Method Completed: 03/06/2024 Sample Type (Check all that apply): IP/PB R&D Stability CTL non-GxP Other R&D Result Table Sample ID Lot Number Specification (if applicable) Result PS-002 PDTP-000046 1.0E+13 vg/mL \u00b1 20% 1.13E+13 c/mL at 246 mL = 2.78E+15 copies Thawed DS PDTP-000046 Report Result 1.71E+13 c/mL at 185 mL = 3.15E+15 copies Diluted DS PDTP-000046 Report Result 1.16E+13 c/mL at 265 mL = 3.07E+15 copies FRM-SOP-AD-ADC-000001 Completed by: Date: oinkmerment Date: 03/10/2024 FAAIA 08/10/24 FAAIA 08/10/24 evul AIAIUFF cominomial 03/06/24 Confidential and Proprietary printed on: 3/6/2024 3:47 PM"
        }
    ]
}